SupportLogId,CharaId,Name,Rarity,SupportLogTypeId,SalePrice,CompositionExp,AwakeningExp,UseRank,GroupNo,AdaptableAppearAppend,PunisherAppearAppend,State,PassiveState,PowerDefaultValue,CltDefaultValue,Awakening1Power,Awakening1Clt,Awakening2Power,Awakening2Clt,Awakening3Power,Awakening3Clt,Awakening4Power,Awakening4Clt,Awakening5Power,Awakening5Clt,NormalLeader,HoloLeader,UiDisplayPowerTitle,UiDisplayPowerContent,Prefab,CutinMode,SkillVoiceId,SkillName,NameInSkillCutin,SkillText,SkillTextInSkillCutin,CharaInfo,CutinImage,CutinImageAwake,StatusCharaIcon,StatusCharaIconAwake,CollectionDisplayStartDate,CollectionEmptyFrameDisplayFlag,DateVersionId,
206000220,999,"《星彩の願い》シリカ",4,3,800,15000,100,1,0,0,0,"s206000220",,10,150,12,140,14,130,16,120,18,110,20,100,2,4,"効果時間","{0}秒","skill_3_2line_moji86","un_2line_moji86",,"アマノガワ・ループホール","アマノガワ・〇〇ループホール","ボス部屋へ移動するワープポイン<br>トを設置し、ラストアタックボー<br>ナスを125％増加させる。<br>覚醒で効果時間が延長。","ワープポイント設置＋ラストアタックで得られるボーナスポイント量上昇","頑張り屋さんの少女は、天の川へ<br>願いをかける。運命のあの人と<br>一緒にいられますように。ずっと<br>隣にいられますように。","slog_206000220","slog_206000220","Chara_icon/206000220","Chara_icon/206000220","2021/07/06 7:00:00",True,"1",
209000230,999,"《宵闇の流星》ユウキ",4,3,800,15000,100,1,0,0,0,"s209000230",,40,165,50,151,55,144,60,137,65,130,70,123,5,10,"攻撃力上昇量","{0}%","skill_3_2line_moji86","un_2line_moji86",,"カササギ・ダークウィング","カササギ・〇〇〇ダークウィング","左右に闇属性のレーザーを<br>照射し、敵にダメージを与える。<br>覚醒で攻撃力が上昇。","左右に闇属性のレーザーを照射","闇夜に流れる願い星。その刹那の<br>輝きは、儚く美しく、何よりも<br>尊い。誰もが見上げる星空で、皆<br>に愛されることだろう。","slog_209000230","slog_209000230","Chara_icon/209000230","Chara_icon/209000230","2021/07/06 7:00:00",True,"1",
217000060,999,"《心舞の熱唱》セブン",5,2,1600,20000,100,1,0,0,0,"s217000060",,30,180,32,160,34,155,35,150,36,145,37,140,2,4,"効果時間","{0}秒","skill_3_2line_moji86","un_2line_moji86",,"ジャガーノート・サウンド","ジャガーノート・サウンド","自パーティがよろけ・ダウン無効<br>状態になり、リーグポイント獲得<br>量が40%増加する。<br>覚醒で効果時間が延長。","よろけ・ダウン無効＋リーグポイント獲得量上昇","天才少女の応援は、何物にも代え<br>がたい価値を持つ。心の繋がりが<br>生み出すパワーを信じて、皆の力<br>を最大限に引き出してくれる。","slog_217000060","slog_217000060","Chara_icon/217000060","Chara_icon/217000060","2021/09/14 7:00:00",True,"1",
204000260,999,"《快勝の導き》シノン",4,2,800,15000,100,1,0,0,0,"s204000260",,20,50,22,47,24,44,26,41,28,38,30,35,2,4,"効果時間","{0}秒","skill_3_2line_moji86","un_2line_moji86","CH_SIN_SUP_016","ヴィクトリー・ロード","ヴィクトリー・〇〇〇ロード","自パーティがよろけ・ダウン無効<br>状態になり、ボスへのダメージが<br>150％上昇する。<br>覚醒で効果時間が延長。","よろけ・ダウン無効＋ボスキラー","勝利への情熱が人一倍強い彼女の<br>声援は、味方の士気を高めてくれ<br>る。勝利の女神の応援を胸に、<br>必ず白星を勝ち取ると誓って。","slog_204000260","slog_204000260","Chara_icon/204000260","Chara_icon/204000260","2021/09/14 7:00:00",True,"1",
205000180,999,"《熱烈な鼓舞》リズベット",4,2,800,15000,100,1,0,0,0,"s205000180",,20,50,22,47,24,44,26,41,28,38,30,35,2,4,"効果時間","{0}秒","skill_3_2line_moji86","un_2line_moji86","CH_LIS_SUP_016","パワフル・マーチ","パワフル・〇〇〇マーチ","自パーティがよろけ・ダウン無効<br>状態になり、<br>STRが100％上昇する。<br>覚醒で効果時間が延長。","よろけ・ダウン無効＋自パーティのSTR上昇","友達想いの溌剌とした応援で、<br>仲間の元気をフル充電！勇気が<br>出ない時も、彼女の声援が力強く<br>背中を押してくれる。","slog_205000180","slog_205000180","Chara_icon/205000180","Chara_icon/205000180","2021/09/14 7:00:00",True,"1",
218000070,999,"《飛躍の舞踊》レイン",4,2,800,15000,100,1,0,0,0,"s218000070",,20,50,22,47,24,44,26,41,28,38,30,35,2,4,"効果時間","{0}秒","skill_3_2line_moji86","un_2line_moji86",,"ドレッドノート・ステップ","ドレッドノート・ステップ","自パーティがよろけ・ダウン無効<br>状態になり、攻撃時に75％の<br>確率で追加攻撃を発生させる。<br>覚醒で効果時間が延長。","よろけ・ダウン無効＋攻撃時に確率で追加攻撃","普段メイドで培ったご奉仕力は、<br>応援の場でも大活躍。細やかな<br>気配りを受け、誰もが実力以上の<br>力を発揮できるはず。","slog_218000070","slog_218000070","Chara_icon/218000070","Chara_icon/218000070","2021/09/14 7:00:00",True,"1",
299000920,999,"《真》インフィニティ・モーメント",5,2,1600,20000,100,1,0,0,0,"s299000920",,76,130,81,128,86,126,91,124,96,122,100,120,5,10,"効果時間","{0}秒","skill_3_2line_moji86","un_2line_moji86",,"レジェンド・オブ・モーメント","レジェンド・オブ・モーメント","ファーストアタックとラスト<br>アタックで得られるボーナス<br>ポイントが15％増加する。<br>覚醒で効果時間が延長。","ファースト＆ラストアタックのボーナスポイント量上昇","浮遊城第100層。その頂に至る<br>道は、真の英雄にしか歩めない<br>だろう。死闘を共にした仲間たち<br>と共に、救世主は頂を目指す。","slog_299000920","slog_299000920","Chara_icon/299000920","Chara_icon/299000920","2021/06/08 7:00:00",True,"1",
299000930,999,"《裏》ホロウ・フラグメント",5,2,1600,20000,100,1,0,0,0,"s299000930",,76,130,81,128,86,126,91,124,96,122,100,120,5,10,"効果時間","{0}秒","skill_3_2line_moji86","un_2line_moji86",,"レジェンド・オブ・ホロウ","レジェンド・オブ・ホロウ","リーグポイント獲得量が<br>10％増加する。<br>覚醒で効果時間が延長。","獲得リーグポイント上昇","浮遊城に隠されたもう一つの<br>物語。かの世界の裏側にある、<br>もう一つの世界での冒険譚は、<br>いつしか宝物に変わる。","slog_299000930","slog_299000930","Chara_icon/299000930","Chara_icon/299000930","2021/06/08 7:00:00",True,"1",
299000940,999,"《絆》ロスト・ソング",5,2,1600,20000,100,1,0,0,0,"s299000940",,20,175,23,155,26,145,29,135,32,125,35,115,2,4,"効果時間","{0}秒","skill_3_2line_moji86","un_2line_moji86",,"レジェンド・オブ・ソング","レジェンド・オブ・ソング","スキルポーションとレコード<br>メダルの位置がミニマップに<br>表示され、移動速度も上昇する。<br>覚醒で効果時間が延長。","スキルポーション＆レコードメダルサーチ発動＋移動速度上昇","妖精界に舞い降りた、1人の天才<br>アイドル。彼女が育む、人々の<br>繋がりの可能性とは。不器用な<br>姉妹はいつしか本物の絆を得る。","slog_299000940","slog_299000940","Chara_icon/299000940","Chara_icon/299000940","2021/06/08 7:00:00",True,"1",
299000950,999,"《心》ホロウ・リアリゼーション",5,2,1600,20000,100,1,0,0,0,"s299000950",,25,100,28,90,31,80,34,70,37,65,40,60,2,4,"効果時間","{0}秒","skill_3_2line_moji86","un_2line_moji86",,"レジェンド・オブ・オリジン","レジェンド・オブ・オリジン","自パーティのSTR・INTを<br>120％上昇させる。<br>覚醒で効果時間が延長。","自パーティのSTR・INT上昇","原初の世界にて、無垢なる存在と<br>の出会いが生んだ奇跡の物語。<br>人々との触れ合いが、少女の心を<br>育んでゆく。","slog_299000950","slog_299000950","Chara_icon/299000950","Chara_icon/299000950","2021/06/08 7:00:00",True,"1",
299000960,999,"《銃》フェイタル・バレット",5,2,1600,20000,100,3,0,0,0,"s299000960",,45,150,47,140,49,135,51,130,53,125,55,120,5,10,"効果時間","{0}秒","skill_3_2line_moji86","un_2line_moji86",,"レジェンド・オブ・バレット","レジェンド・オブ・バレット","【獲得ポイントが3位の時のみ発動可能】リーグポイント獲得量が50％増加する。<br>覚醒で効果時間が延長。","【発動条件・3位】獲得リーグポイント上昇","強さこそが物を言う、銃の世界。<br>沢山の出会いとバトルを経た先に<br>待ち受ける命を賭した戦いとは。<br>これは、君自身の選択の物語。","slog_299000960","slog_299000960","Chara_icon/299000960","Chara_icon/299000960","2021/06/08 7:00:00",True,"1",
218000080,999,"《あなたのために》虹架",5,3,1600,20000,100,1,0,0,0,"s218000080",,1,100,2,95,2,90,3,85,3,80,3,70,1,2,"ドロップ数","{0}個","skill_3_2line_moji86","un_2line_moji86",,"ディア・レイン","ディア・〇〇〇〇レイン","グリードを1体召喚。<br>覚醒でスキルポーションの<br>ドロップ数が増加。","グリードを召喚","学校とバイト、そして夢。やらな<br>きゃいけないことが沢山あるけれ<br>ど、皆がいるから頑張れる。今日<br>はお礼に、沢山ご奉仕するね。","slog_218000080","slog_218000080","Chara_icon/218000080","Chara_icon/218000080","2021/06/01 7:00:00",True,"1",
299000970,999,"《お姉ちゃんの休息》イーディス",5,3,1600,20000,100,1,0,0,0,"s299000970",,1,100,2,95,2,90,3,85,3,80,3,70,1,2,"ドロップ数","{0}個","skill_3_2line_moji86","un_2line_moji86",,"ディア・イーディス","ディア・〇〇〇〇イーディス","グリードを1体召喚。<br>覚醒でスキルポーションの<br>ドロップ数が増加。","グリードを召喚","今日は任務もお休み。だから、<br>一緒に過ごせる時間を大切にしよ<br>う。愛すべき日常も、永遠に続く<br>とは限らないから。","slog_299000970","slog_299000970","Chara_icon/299000970","Chara_icon/299000970","2021/07/01 7:00:00",True,"1",
299000980,999,"《今日は素直に》メディナ",5,3,1600,20000,100,1,0,0,0,"s299000980",,1,100,2,95,2,90,3,85,3,80,3,70,1,2,"ドロップ数","{0}個","skill_3_2line_moji86","un_2line_moji86",,"ディア・メディナ","ディア・〇〇〇〇メディナ","グリードを1体召喚。<br>覚醒でスキルポーションの<br>ドロップ数が増加。","グリードを召喚","普段は照れ臭くて伝えられないこ<br>とも、特別な今日は態度と言葉で<br>示してみたい。仲間以上に大切な<br>あなたへ。","slog_299000980","slog_299000980","Chara_icon/299000980","Chara_icon/299000980","2021/08/01 7:00:00",True,"1",
215000100,999,"《お出かけモード》ストレア",5,3,1600,20000,100,1,0,0,0,"s215000100",,1,100,2,95,2,90,3,85,3,80,3,70,1,2,"ドロップ数","{0}個","skill_3_2line_moji86","un_2line_moji86",,"ディア・ストレア","ディア・〇〇〇〇ストレア","グリードを1体召喚。<br>覚醒でスキルポーションの<br>ドロップ数が増加。","グリードを召喚","今日は一緒にお出かけの日！<br>とびきり可愛いお洋服で、今日は<br>あなたを独り占め。さぁ、どこへ<br>行ってみようか？","slog_215000100","slog_215000100","Chara_icon/215000100","Chara_icon/215000100","2021/09/01 7:00:00",True,"1",
299000990,999,"《自分の道を》紅葉",5,3,1600,20000,100,1,0,0,0,"s299000990",,1,100,2,95,2,90,3,85,3,80,3,70,1,2,"ドロップ数","{0}個","skill_3_2line_moji86","un_2line_moji86",,"ディア・クレハ","ディア・〇〇〇〇クレハ","グリードを1体召喚。<br>覚醒でスキルポーションの<br>ドロップ数が増加。","グリードを召喚","上を見上げてばかりの人生だった<br>けれど、もう迷わない。今日と言<br>う特別な日を、胸を張って生きて<br>いけるのは、君が一緒だから。","slog_299000990","slog_299000990","Chara_icon/299000990","Chara_icon/299000990","2021/10/01 7:00:00",True,"1",
217000070,999,"《今日は家族と》七色",5,3,1600,20000,100,1,0,0,0,"s217000070",,1,100,2,95,2,90,3,85,3,80,3,70,1,2,"ドロップ数","{0}個","skill_3_2line_moji86","un_2line_moji86",,"ディア・セブン","ディア・〇〇〇〇セブン","グリードを1体召喚。<br>覚醒でスキルポーションの<br>ドロップ数が増加。","グリードを召喚","大切な日は、大切な人と。多忙な<br>研究も今日はお休みにして、遠い<br>かの地へ行ってみようか。大切な<br>仲間と、家族の待つ場所へ。","slog_217000070","slog_217000070","Chara_icon/217000070","Chara_icon/217000070","2021/11/01 7:00:00",True,"1",
299001000,999,"《ずっと一緒に》プレミア＆ティア",5,3,1600,20000,100,1,0,0,0,"s299001000",,1,100,2,95,2,90,3,85,3,80,3,70,1,2,"ドロップ数","{0}個","skill_3_2line_moji86","un_2line_moji86",,"ディア・プレミア・アンド・ティア","ディア・プレミア・アンド・ティア","グリードを1体召喚。<br>覚醒でスキルポーションの<br>ドロップ数が増加。","グリードを召喚","共に生まれた2人は、それぞれの<br>道で、心を育んでいった。2人の<br>大事な今日は、思い出を分け合っ<br>て、皆で一緒に過ごそうか。","slog_299001000","slog_299001000","Chara_icon/299001000","Chara_icon/299001000","2021/12/01 7:00:00",True,"1",
299001010,999,"《もちもちお年賀》テリア",5,3,1600,20000,100,1,0,0,0,"s299001010",,1,100,2,95,2,90,3,85,3,80,3,70,1,2,"ドロップ数","{0}個","skill_3_2line_moji86","un_2line_moji86",,"ディア・テリア","ディア・〇〇〇〇テリア","グリードを1体召喚。<br>覚醒でスキルポーションの<br>ドロップ数が増加。","グリードを召喚","βeater's cafeにも<br>お正月が到来！もちもち伸び～る<br>お雑煮片手に、本年もよろしく<br>お願いいたします！","slog_299001010","slog_299001010","Chara_icon/299001010","Chara_icon/299001010","2022/01/01 7:00:00",True,"1",
299001020,999,"《芽吹きの季節》小春",5,3,1600,20000,100,1,0,0,0,"s299001020",,1,100,2,95,2,90,3,85,3,80,3,70,1,2,"ドロップ数","{0}個","skill_3_2line_moji86","un_2line_moji86",,"ディア・コハル","ディア・〇〇〇〇コハル","グリードを1体召喚。<br>覚醒でスキルポーションの<br>ドロップ数が増加。","グリードを召喚","春目前の今日。穏やかに笑って<br>迎えられたのは、隣に君がいてく<br>れたから。この気持ちが芽吹くの<br>も、もう時間の問題かも。","slog_299001020","slog_299001020","Chara_icon/299001020","Chara_icon/299001020","2022/02/01 7:00:00",True,"1",
216000090,999,"《現実の宝物》琴音",5,3,1600,20000,100,1,0,0,0,"s216000090",,1,100,2,95,2,90,3,85,3,80,3,70,1,2,"ドロップ数","{0}個","skill_3_2line_moji86","un_2line_moji86",,"ディア・フィリア","ディア・〇〇〇〇フィリア","グリードを1体召喚。<br>覚醒でスキルポーションの<br>ドロップ数が増加。","グリードを召喚","君がくれた宝物は、ずっと心の<br>真ん中にある。現実世界で過ごす<br>特別な今日を、君と共に。一緒な<br>ら、宝物ももっと見つかるから。","slog_216000090","slog_216000090","Chara_icon/216000090","Chara_icon/216000090","2022/03/01 7:00:00",True,"1",
299001030,999,"《いつも通りの日々》雪嗣",5,3,1600,20000,100,1,0,0,0,"s299001030",,1,100,2,95,2,90,3,85,3,80,3,70,1,2,"ドロップ数","{0}個","skill_3_2line_moji86","un_2line_moji86",,"ディア・イツキ","ディア・〇〇〇〇イツキ","グリードを1体召喚。<br>覚醒でスキルポーションの<br>ドロップ数が増加。","グリードを召喚","どこか味気ないのは、隣に君がい<br>ないからだろうか。いつも通りの<br>日常の最中。特別な日に、特別な<br>存在である君を想って。","slog_299001030","slog_299001030","Chara_icon/299001030","Chara_icon/299001030","2022/03/30 7:00:00",True,"1",
299001040,999,"《お仕事の時間》翠子",5,3,1600,20000,100,1,0,0,0,"s299001040",,1,100,2,95,2,90,3,85,3,80,3,70,1,2,"ドロップ数","{0}個","skill_3_2line_moji86","un_2line_moji86",,"ディア・ツェリスカ","ディア・〇〇〇〇ツェリスカ","グリードを1体召喚。<br>覚醒でスキルポーションの<br>ドロップ数が増加。","グリードを召喚","特別な今日だからこそ、普段通り<br>仕事に向かう。誇りある大事な仕<br>事だから。これが終わったら、皆<br>でパーッと銃をぶっ放そう！","slog_299001040","slog_299001040","Chara_icon/299001040","Chara_icon/299001040","2022/05/01 7:00:00",True,"1",
204000270,999,"《極暑の涼銃》シノン",5,3,1600,20000,100,1,0,0,0,"s204000270",,65,210,68,204,71,201,73,198,75,196,77,194,10,20,"攻撃力上昇量","{0}%","skill_3_2line_moji86","un_2line_moji86",,"スプラッシュ・バレット","スプラッシュ・〇バレット","一定時間、前方にレーザー状の強力な水属性攻撃を照射し敵にダメージを与える。覚醒で攻撃力が上昇。","一定時間、レーザー状の強力な水属性攻撃を前方に照射","愛銃が水鉄砲に大変身？！…とい<br>うわけでなく海辺のマナーを守っ<br>て込める弾丸は海水に。武器が変<br>わろうと、腕前は変わらない。","slog_204000270","slog_204000270","Chara_icon/204000270","Chara_icon/204000270","2021/07/27 7:00:00",True,"1",
201000170,999,"《大波の黒弾》キリト",4,3,800,15000,100,1,0,0,0,"s201000170",,40,165,50,151,55,144,60,137,65,130,70,123,5,10,"攻撃力上昇量","{0}%","skill_3_2line_moji86","un_2line_moji86",,"スプラッシュ・リロード","スプラッシュ・〇リロード","一定時間、前方に水属性の弾を連射して敵にダメージを与える。覚醒で攻撃力が上昇。","一定時間、前方に水属性の弾を連射","銃と剣のプレイスタイルから一転<br>銃のみで戦うと決めたよう。引き<br>金を引かれる前に、素早く距離を<br>つめるのは彼しか出来ない芸当。","slog_201000170","slog_201000170","Chara_icon/201000170","Chara_icon/201000170","2021/07/27 7:00:00",True,"1",
203000270,999,"《嬉戯の煌花》リーファ",4,3,800,15000,100,1,0,0,0,"s203000270",,40,165,50,151,55,144,60,137,65,130,70,123,5,10,"攻撃力上昇量","{0}%","skill_3_2line_moji86","un_2line_moji86",,"スプラッシュ・ショット","スプラッシュ・〇ショット","一定時間、前方に水属性の弾を放射状に連射して敵にダメージを与える。覚醒で攻撃力が上昇。","一定時間、前方に水属性の弾を放射状に連射","剣道で鍛えた動体視力は伊達じゃ<br>ない。砂浜のガンナーとして妖精<br>の実力を見せる時。いざとなれば<br>間合いをつめて戦うそう。","slog_203000270","slog_203000270","Chara_icon/203000270","Chara_icon/203000270","2021/07/27 7:00:00",True,"1",
209000240,999,"《炎陽の閃水》ユウキ",4,3,800,15000,100,1,0,0,0,"s209000240",,40,165,50,151,55,144,60,137,65,130,70,123,5,10,"攻撃力上昇量","{0}%","skill_3_2line_moji86","un_2line_moji86",,"スプラッシュ・ストライカー","スプラッシュ・〇ストライカー","一定時間、前方にレーザー状の水属性攻撃を照射し敵にダメージを与える。覚醒で攻撃力が上昇。","一定時間、レーザー状の水属性攻撃を前方に照射","彼女の編み出した11連撃が水鉄<br>砲に適用され、11連射に？！<br>生まれ変わった愛剣と辻デュエル<br>を挑んで勝利しよう。","slog_209000240","slog_209000240","Chara_icon/209000240","Chara_icon/209000240","2021/07/27 7:00:00",True,"1",
206000230,999,"《キャンディポップ》シリカ",5,2,1600,20000,100,1,0,0,0,"s206000230",,10,120,11,116,12,112,13,108,14,104,15,100,2,4,"効果時間","{0}秒","skill_3_2line_moji86","un_2line_moji86","CH_SIL_SUP_024","レモネード・サマー","レモネード・〇〇サマー","自パーティのSTRを700%上昇させる。覚醒で効果時間が延長。","自パーティのSTR上昇","アイスをかじってひと休み。たく<br>さんのフレーバーから檸檬を選ぶ<br>と、甘くてすっぱい夏の味が口の<br>中に広がっていった。","slog_206000230","slog_206000230","Chara_icon/206000230","Chara_icon/206000230","2021/08/03 7:00:00",True,"1",
204000280,999,"《オーシャンケットシー》シノン",4,2,800,15000,100,1,0,0,0,"s204000280",,60,120,65,115,70,110,75,105,78,102,80,100,10,20,"効果時間","{0}秒","skill_3_2line_moji86","un_2line_moji86","CH_SIN_SUP_024","スウェイト・テール","スウェイト・〇〇テール","Mobに与えるダメージを100%上昇させ、自パーティの移動速度を上昇させる。覚醒で効果時間が延長。","Mobキラー＋移動速度上昇","砂浜で皆と追いかけっこ。銃や弓<br>よりずっと単純だけど、大好きな<br>仲間たちとする遊びはなんでも<br>楽しくて揺れる尻尾が隠せない。","slog_204000280","slog_204000280","Chara_icon/204000280","Chara_icon/204000280","2021/08/03 7:00:00",True,"1",
211000100,999,"《サマーサンシャイン》アリス",4,2,800,15000,100,1,0,0,0,"s211000100",,20,100,22,97,24,94,26,91,28,88,30,85,5,10,"効果時間","{0}秒","skill_3_2line_moji86","un_2line_moji86","CH_ALI_SUP_024","ブリム・オブ・ハット","ブリム・オブ・〇〇ハット","自パーティに敵の注目を集め、リーグポイント獲得量を30％上昇させる。覚醒で効果時間が延長。","自パーティに敵の注目を集める＋獲得リーグポイント上昇","パラソルの下、賑やかな仲間を眺<br>めながら南国のジュースに口を付<br>ける。火照る頬がバレないように<br>麦わら帽子を深く被った。","slog_211000100","slog_211000100","Chara_icon/211000100","Chara_icon/211000100","2021/08/03 7:00:00",True,"1",
290000140,999,"《サマープリティ》ユイ",4,2,800,15000,100,1,0,0,0,"s290000140",,10,40,12,38,14,36,16,34,18,32,20,30,2,4,"効果時間","{0}秒","skill_3_2line_moji86","un_2line_moji86","CH_YUI_SUP_024","スウィート・ビーチ","スウィート・〇〇ビーチ","自パーティのINTを150％上昇させ、ラストアタックボーナスを35％増加させる。覚醒で効果時間が延長。","INT上昇＋ラストアタックで得られるボーナスポイント量上昇","可愛らしいフリルとリボンが彼女<br>の愛らしさを引き立てる。もう少<br>し休憩したら、今度は向こうの浜<br>辺に行こう。","slog_290000140","slog_290000140","Chara_icon/290000140","Chara_icon/290000140","2021/08/03 7:00:00",True,"1",
216000100,999,"《夏夜の彩り》フィリア",5,2,1600,20000,100,1,0,0,0,"s216000100","s216000100_passive",10,65,11,62,12,59,13,56,14,53,15,50,2,4,"効果時間","{0}秒","skill_3_2line_moji86","un_2line_moji86",,"モーニング・ナイト","モーニング・〇〇ナイト","自パーティのINTが300％上昇。覚醒で効果時間が延長。【パッシブ】ラストアタック毎にボーナス増加。","自パーティのINT上昇","夜に咲く大輪の朝顔と花火たちが<br>あまりにも華やかだから、見失い<br>そうになる。大切な宝物は既に手<br>の中でそっと咲いているのだ。","slog_216000100","slog_216000100","Chara_icon/216000100","Chara_icon/216000100","2021/08/24 7:00:00",True,"1",
202000330,999,"《月下の憩い》アスナ",4,2,800,15000,100,1,0,0,0,"s202000330",,15,100,16,95,17,90,18,85,19,80,20,75,2,4,"効果時間","{0}秒","skill_3_2line_moji86","un_2line_moji86","CH_ASU_SUP_025","ノクス・チェリー","ノクス・チェリー","自パーティのSTRとINTを<br>200％上昇させる。覚醒で効果時間が延長。","自パーティのSTR・INT上昇","喧騒を避けて高台へ。先ほどまで<br>巡っていた屋台は遠く、静かな境<br>内には二人の声がよく通る。囁き<br>あって花火の輪郭をなぞった夏。","slog_202000330","slog_202000330","Chara_icon/202000330","Chara_icon/202000330","2021/08/24 7:00:00",True,"1",
204000290,999,"《納涼の弓姫》シノン",4,2,800,15000,100,1,0,0,0,"s204000290",,10,60,12,58,14,56,16,54,18,52,20,50,2,4,"効果時間","{0}秒","skill_3_2line_moji86","un_2line_moji86","CH_SIN_SUP_025","バタフライ・リボン","バタフライ・〇〇リボン","自パーティのSTRを150％上昇させ、ファーストアタックボーナスを35％増加させる。覚醒で効果時間が延長。","STR上昇＋ファーストアタックで得られるボーナスポイント量上昇","妖精たちの間を縫って、もっと、<br>もっと前の席へ。逸る気持ちと足<br>取りを見失わないよう、揺れる帯<br>の蝶々を見つめた。","slog_204000290","slog_204000290","Chara_icon/204000290","Chara_icon/204000290","2021/08/24 7:00:00",True,"1",
